{
  "$schema": "https://json-schema.org/draft/2020-12/schema",
  "$id": "https://raiatea.dev/schema/pedagogical-module.schema.json",
  "title": "Raiatea Pedagogical Visual Module",
  "type": "object",
  "required": ["id", "title", "language", "route", "prerequisites", "visual", "steps", "concepts", "next"],
  "properties": {
    "id": {"type": "string", "pattern": "^[a-z0-9-]+$"},
    "title": {"type": "string", "minLength": 1},
    "subtitle": {"type": "string"},
    "language": {"type": "string", "default": "it"},
    "source": {
      "type": "object",
      "properties": {
        "title": {"type": "string"},
        "chapter": {"type": "string"},
        "section": {"type": "string"},
        "pages": {"type": "array", "items": {"type": "integer"}},
        "figure": {"type": "string"}
      },
      "additionalProperties": false
    },
    "route": {
      "type": "object",
      "required": ["summary", "previous"],
      "properties": {
        "summary": {"type": "string"},
        "previous": {"type": "array", "items": {"type": "string"}}
      },
      "additionalProperties": false
    },
    "difficulty": {
      "type": "object",
      "properties": {
        "conceptual": {"type": "integer", "minimum": 1, "maximum": 5},
        "mathematics": {"type": "integer", "minimum": 1, "maximum": 5},
        "code": {"type": "integer", "minimum": 1, "maximum": 5},
        "minutes": {"type": "integer", "minimum": 1}
      },
      "additionalProperties": false
    },
    "prerequisites": {
      "type": "array",
      "items": {
        "type": "object",
        "required": ["concept", "level", "summary"],
        "properties": {
          "concept": {"type": "string"},
          "level": {"enum": ["required", "useful", "optional"]},
          "summary": {"type": "string"},
          "conceptRef": {"type": "string"}
        },
        "additionalProperties": false
      }
    },
    "visual": {
      "oneOf": [
        {
          "type": "object",
          "required": ["type", "markup"],
          "properties": {
            "type": {"enum": ["svg", "html"]},
            "markup": {"type": "string", "minLength": 1}
          },
          "additionalProperties": false
        },
        {
          "type": "object",
          "required": ["type", "items"],
          "properties": {
            "type": {"const": "primitives"},
            "width": {"type": "integer", "minimum": 100},
            "height": {"type": "integer", "minimum": 100},
            "title": {"type": "string"},
            "description": {"type": "string"},
            "items": {
              "type": "array",
              "minItems": 1,
              "items": {"$ref": "#/$defs/visualPrimitive"}
            }
          },
          "additionalProperties": false
        }
      ]
    },
    "steps": {
      "type": "array",
      "minItems": 1,
      "items": {
        "type": "object",
        "required": ["title", "explanation", "goal", "observe", "quiz"],
        "properties": {
          "eyebrow": {"type": "string"},
          "title": {"type": "string"},
          "explanation": {"type": "string"},
          "goal": {"type": "string"},
          "observe": {"type": "string"},
          "equation": {"type": "string"},
          "activeNodes": {"type": "array", "items": {"type": "string"}},
          "animatedFlows": {"type": "array", "items": {"type": "string"}},
          "quiz": {
            "type": "object",
            "required": ["question", "answers", "correctIndex", "correctFeedback", "incorrectFeedback"],
            "properties": {
              "question": {"type": "string"},
              "answers": {"type": "array", "minItems": 2, "items": {"type": "string"}},
              "correctIndex": {"type": "integer", "minimum": 0},
              "correctFeedback": {"type": "string"},
              "incorrectFeedback": {"type": "string"}
            },
            "additionalProperties": false
          }
        },
        "additionalProperties": false
      }
    },
    "concepts": {
      "type": "array",
      "items": {
        "type": "object",
        "required": ["id", "label", "definition"],
        "properties": {
          "id": {"type": "string", "pattern": "^[a-z0-9-]+$"},
          "label": {"type": "string"},
          "definition": {"type": "string"},
          "usedFor": {"type": "string"},
          "confusedWith": {"type": "string"}
        },
        "additionalProperties": false
      }
    },
    "next": {
      "type": "object",
      "required": ["summary", "items"],
      "properties": {
        "summary": {"type": "string"},
        "items": {"type": "array", "minItems": 1, "items": {"type": "string"}}
      },
      "additionalProperties": false
    }
  },
  "$defs": {
    "basePrimitive": {
      "type": "object",
      "required": ["kind", "id"],
      "properties": {
        "kind": {"type": "string"},
        "id": {"type": "string", "pattern": "^[a-z0-9-]+$"}
      }
    },
    "visualPrimitive": {
      "oneOf": [
        {
          "type": "object",
          "required": ["kind", "id", "x", "y", "title"],
          "properties": {
            "kind": {"const": "box"},
            "id": {"type": "string", "pattern": "^[a-z0-9-]+$"},
            "x": {"type": "number"}, "y": {"type": "number"},
            "width": {"type": "number", "exclusiveMinimum": 0},
            "height": {"type": "number", "exclusiveMinimum": 0},
            "title": {"type": "string"}, "subtitle": {"type": "string"},
            "tone": {"enum": ["neutral", "input", "process", "attention", "output", "warning"]}
          },
          "additionalProperties": false
        },
        {
          "type": "object",
          "required": ["kind", "id", "x", "y", "values"],
          "properties": {
            "kind": {"const": "vector"},
            "id": {"type": "string", "pattern": "^[a-z0-9-]+$"},
            "x": {"type": "number"}, "y": {"type": "number"},
            "label": {"type": "string"},
            "values": {"type": "array", "minItems": 1, "items": {"type": ["number", "string"]}},
            "cellWidth": {"type": "number", "exclusiveMinimum": 0}
          },
          "additionalProperties": false
        },
        {
          "type": "object",
          "required": ["kind", "id", "x", "y", "text"],
          "properties": {
            "kind": {"const": "text"},
            "id": {"type": "string", "pattern": "^[a-z0-9-]+$"},
            "x": {"type": "number"}, "y": {"type": "number"},
            "text": {"type": "string"}
          },
          "additionalProperties": false
        },
        {
          "type": "object",
          "required": ["kind", "id", "path"],
          "properties": {
            "kind": {"const": "edge"},
            "id": {"type": "string", "pattern": "^[a-z0-9-]+$"},
            "path": {"type": "string", "minLength": 1},
            "label": {"type": "string"},
            "labelX": {"type": "number"}, "labelY": {"type": "number"}
          },
          "additionalProperties": false
        }
      ]
    }
  },
  "additionalProperties": false
}